{
  "schema_version": "0.2",
  "release": "0.2_2026-10-26_b3edd07",
  "status": "compatibility",
  "default_language": "en",
  "bootstrap": "START-HERE.md",
  "fallback_bundle": "guides/greedyq-guide.md",
  "components": {
    "consent": {
      "id": "consent",
      "kind": "module",
      "version": "0.2.0-draft.1",
      "manifest": "guides/modules/consent/component.json",
      "manifest_sha256": "38d77987410483ad5e2506c2961c9f825d5d023f1284c20696d065825c9600dd",
      "dependencies": [
        "core",
        "governance-irb"
      ],
      "conflicts": [],
      "files": [
        {
          "path": "guides/modules/consent/guide.md",
          "sha256": "1043f37dff062c9d515d8dbed6ae7bc93806f9877ba79bcef7294787b34c79d3"
        },
        {
          "path": "guides/modules/consent/checkpoints.json",
          "sha256": "760c8769c8710006016bef4532dd539904106a8d74bb110be9d3859324eaee6f"
        }
      ]
    },
    "core": {
      "id": "core",
      "kind": "core",
      "version": "0.2.0-draft.1",
      "object_name": "greedyQObject",
      "manifest": "guides/core/component.json",
      "manifest_sha256": "2ccf979fcc6eb52d93f8db16878bca0664d0cb93ad96e09642189f21be48d58a",
      "dependencies": [],
      "conflicts": [],
      "files": [
        {
          "path": "release.json",
          "sha256": "9eafdf8b46243f403458c7b8b1406eaa8b0c8672fff23d6ce996cfbba9712cfb"
        },
        {
          "path": "greedyq/localization.py",
          "sha256": "16c2b87d6217f3b7a26292f52270f1fefdd6c03b39a573ba2201bfa46a39449d"
        },
        {
          "path": "greedyq/locale-messages.json",
          "sha256": "828a40c39808aed1945a60f56636b8baaaf970f17585fdbce8a1e02955be57ad"
        },
        {
          "path": "docs/surveydown-compatibility-audit.md",
          "sha256": "f197e83c19999a61d870d0a21d3e9cc3cb3d33b99ed5b85500b4b5d48118abe8"
        },
        {
          "path": "EXTERNAL-RETURNS.md",
          "sha256": "a8b0eab478851709e3800244e422ce583679c78688e2dfe5bf4e3bb9a023457e"
        },
        {
          "path": "greedyq/formatting.py",
          "sha256": "8fd9f5c651047689c796408445b3fe941c59d785b906df53eff67ba35541357d"
        },
        {
          "path": "PREREGISTRATION.md",
          "sha256": "5e591d4c3a82367cc03ae8ffc0ae450095595e0249ad6b5cb799d61f38bcf948"
        },
        {
          "path": "UPGRADING.md",
          "sha256": "11f423a8eff5445a9dd4028f03cc248dba6e5ef06430b5a711dc1e16b150713d"
        },
        {
          "path": "tools/upgrade_study.py",
          "sha256": "4c119a08d2b8c7b33197519c8a3deb284592bef7871d5f75f829f591887ae8ba"
        },
        {
          "path": "tools/resolve_guide.py",
          "sha256": "43bd76be9ca6fc61ba70f11a508ab00a88f1897bff13619b80af7df0e320d043"
        },
        {
          "path": "greedyq/osf_fields.py",
          "sha256": "06a6b117da1bcd2787262638271636bd8b03e720764d6462c7884b22c8a33313"
        },
        {
          "path": "greedyq/redirects.py",
          "sha256": "7f49acd235e1917d8b6f8de640f9968bfb007a783f761478ddf8be47cdb206ce"
        },
        {
          "path": "RANDOMIZATION.md",
          "sha256": "70fd5b84beec551f10fe2009df6ef2ed4c29125661dfb5fa9ac6dbf7afcf1c15"
        },
        {
          "path": "docs/repeat-user-acceptance.md",
          "sha256": "e4ac09088948632e1af72013a322066340363e28143cd9dba86394d4159e54d6"
        },
        {
          "path": "ARCHIVING.md",
          "sha256": "2cd3f93025283bffa3efd204a3b9fa48b2baa9aa11cb19a61c63ea5d262d23d7"
        },
        {
          "path": "docs/cloud-lifecycle.md",
          "sha256": "ced288ab2dd3cafdc53aa8aa0631f616c4cc4f56b6a534cd131b996a400bcd81"
        },
        {
          "path": "tools/cloud_lifecycle.cjs",
          "sha256": "58aeb8bb6619a07ecae0994a06dea65bbcf4653de0492b0aa5b9611203a61f30"
        },
        {
          "path": "tools/archive_study.cjs",
          "sha256": "420a2a17128d4d4e5b3b822c58d1418de225583c9a71908d44bf67bb444fe117"
        },
        {
          "path": "greedyq/archive.py",
          "sha256": "eb576fee68764960ea2a734c5e44b258e00ca2992606a50cc37291cd2f2b633e"
        },
        {
          "path": "guides/core/guide.md",
          "sha256": "4aa4389b71916a285fe8f512abc722927f024a8a67bf3a92e062fd330cc9edb9"
        },
        {
          "path": "guides/core/communication.md",
          "sha256": "707ad574d9bf20e3a0d34c6d351332a74a0dd85b734a04b8629ef2939bf44cf9"
        },
        {
          "path": "guides/core/checkpoints.json",
          "sha256": "2f27f4fb6824b8de340dce5b8b82872a13142221aed43fc6c24b21bbc640deec"
        },
        {
          "path": "docs/greedyq-v0.2-spec.md",
          "sha256": "36435ee202375ae331822df1a253f9b9f4e9e436597b860b3a03b1acd41914a2"
        },
        {
          "path": "docs/preview-ui-spec.md",
          "sha256": "1f299ece6e45ea77fdd3397e1ec29ee326e0af6bba33a0a9774e24edbfdbe2d7"
        },
        {
          "path": "schemas/ai/study-state.schema.json",
          "sha256": "0a75be2a29e382030d2c500dcc3144c91574fce235673904004ef999791e5ea5"
        },
        {
          "path": "schemas/ai/decision-log.schema.json",
          "sha256": "a937bf06a1249069de1f3bd997252bb11addec5956a0e6a0b8546a1f14bca188"
        },
        {
          "path": "schemas/ai/unresolved-decisions.schema.json",
          "sha256": "8876e4eb598a0e727fbe5df77c7aa0b3f68678a102942c585c7126c126307a3c"
        },
        {
          "path": "schemas/ai/generation-manifest.schema.json",
          "sha256": "ecd00180d3ed0caf61ce2fa201ef21cdff8a7404efae025d140b2c69252eb51e"
        },
        {
          "path": "schemas/ai/validation-report.schema.json",
          "sha256": "bb682c8950ccaf1e3a12145009ac843ec7fb4ed20bdf2a95fb1fe03b37b13d5d"
        },
        {
          "path": "schemas/preview-model.schema.json",
          "sha256": "578ae49e321c6524eae6afb3fc4a562c922b2b0ec1493ed54962d56ae8ef0aa3"
        },
        {
          "path": "web/greedyq-core.js",
          "sha256": "1f4e0d8d45cfc4e6c4637fe19f617abbbd4afe7ce4e796c81243661ebaaf8931"
        },
        {
          "path": "web/greedyq-runtime.css",
          "sha256": "a01301059304092c7b219c52e8c3d34900aa3430f07606bf9a673901e027a977"
        },
        {
          "path": "templates/browser/respondent.html",
          "sha256": "57ea6ab3f198d3e1e442f23eeb399e41f85c23aac375b5ece850672be2155752"
        },
        {
          "path": "templates/browser/preview.html",
          "sha256": "716b58aa250eeb33a0625056456e719a257af3f18b3abde2437f9b04290beba4"
        },
        {
          "path": "templates/browser/studio.html",
          "sha256": "da427b818db268ab20c6967174e73dc14537ecdabf710192eb3e3410ac60504a"
        },
        {
          "path": "templates/supabase/002_browser_rpc.sql",
          "sha256": "56ba87cf87a92e714b408648f4b64579a6d5a7ee1bae8bb79b390e8435249514"
        },
        {
          "path": "templates/supabase/004_randomization.sql",
          "sha256": "959fcffdb0df4f753ff81e9733e72a925a357522aa0e5fc1dd125ced9718f519"
        },
        {
          "path": "templates/supabase/005_prolific.sql",
          "sha256": "cf67178ae3a6503b208e471686f043227a1c20d62e3d81060d76af71863bb52e"
        },
        {
          "path": "templates/supabase/006_withdrawal_preview.sql",
          "sha256": "b60808de5814f0a852db44a444d6d1b1e042ef6635860de2aaebdf642b9fc4b1"
        },
        {
          "path": "templates/supabase/007_answer_snapshot.sql",
          "sha256": "6d30ebdf1403c26864dc6d333e801cbcfe34eae3222883b07f6bfff970fc80f2"
        },
        {
          "path": "templates/supabase/008_terminal_timestamp.sql",
          "sha256": "329195070e1693b68a9b37cee9d902c8f3aae03c42d31a1a6353f445292f2d7b"
        },
        {
          "path": "templates/supabase/connection-test.html",
          "sha256": "ea55cec1e3ba62244b143dfe5dcd3840ae7fcf7ff483af45113dec445ffc3123"
        },
        {
          "path": "greedyq/__init__.py",
          "sha256": "7f64ab6785db658e4df984c9239da285e509f4477ae95386507e96cf13cec203"
        },
        {
          "path": "greedyq/__main__.py",
          "sha256": "3d9b823a77b56ff8a4e53ae9efeba15113e2da427965566279d61c1f66340cb6"
        },
        {
          "path": "greedyq/yaml_min.py",
          "sha256": "87f26691adc3c02864bc9ed92b7908977f7257210935b309b6cdf2851ab66b9e"
        },
        {
          "path": "greedyq/parser.py",
          "sha256": "aa0cb4273b9812292308647eda61e30e591f07dd7e147c94f04ff2c292f64803"
        },
        {
          "path": "greedyq/validator.py",
          "sha256": "d6170a2163b212056db7a0348ef966dd24cffa0317894150ecc95a37a4a10df3"
        },
        {
          "path": "greedyq/compiler.py",
          "sha256": "5cae694ad468ca05913835896bbafb2c2621eefbd5d83174cd4185f9663f98eb"
        },
        {
          "path": "greedyq/build.py",
          "sha256": "a9e2b23f14cd9192fad2aa774beb9aa809375f16db1c590dfee7a4da95d403e4"
        },
        {
          "path": "greedyq/runtime.py",
          "sha256": "0d53de1caa9b408c8f01f1763585a3ac89034d50a5b238fdc73d388119657ec9"
        },
        {
          "path": "greedyq/randomization.py",
          "sha256": "fa9ef565053e9fbdb0321b77b263674045108c55910633ac2b9a7405c3d907ee"
        },
        {
          "path": "greedyq/server.py",
          "sha256": "73448bfdb61f7f1d586549bf696bc369e42f992a6cbea3d621a6eae9d1421c65"
        },
        {
          "path": "greedyq/prolific.py",
          "sha256": "ba134506dfcce5c3bd126d3cba10bd29df449e260ea8ecf37f40abfc369747b7"
        },
        {
          "path": "greedyq/preregistration.py",
          "sha256": "2846fe9f7175b6f740c0b228efb4adb5bf05d11d311cc2ca4e5ccbb7af09b99c"
        },
        {
          "path": "greedyq/exporter.py",
          "sha256": "acb2a62977f5d693db33ba1351c04e85d9a74a324e05e3afc69774df7eeb0da0"
        },
        {
          "path": "greedyq/deployment.py",
          "sha256": "1ea7f06450f9bb277c5374859acecb4e86479dca331d47838060006abed89524"
        },